64,Administrative Support Officer - Moonah,"Deliver comprehensive administrative services at The District Nurses, ensuring high-quality outcomes for both internal and external stakeholders",AO-MOO 2,"1. Evidence of being able to demonstrate a high level of professionalism and confidentiality 2. Excellent verbal, written communication, and interpersonal skills 3. Strong computer literacy, specifically in client management systems and word-based software (eg. Word, outlook) 4. Ability to work independently, and prioritise work within established policies, guidelines and procedures 5. Ability to communicate with a range of internal and external stakeholders",2025-03-20 00:24:19+00:00,2025-03-20 00:27:20+00:00,thedistrictnurses,SYD
21,Kinship Case Contracting Case Manager,"The Position This position works with children and young people on statutory orders in out of home care placements. The worker will establish placement supports for new placements and make referrals to appropriate support services for carers, children and families. This position is also required to write detailed assessments of families and carers, placement suitability and support needs ensuring that the plan supports connection to their Aboriginal Culture and the Community. Key Responsibilities Participate in comprehensive family assessment that identify strengths and goals with a focus on the health, wellbeing and safety needs of the children involved. Participate in the development of comprehensive family plans using a wrap-around model of support and facilitate ongoing reviews/ evaluation of family plans. Refer children and/or families to appropriate services based on needs and goals, work in conjunction with services to ensure that referrals are responded to in a way that acknowledges the unique needs of each referral and situation. Complete comprehensive case notes and reports such as: reports to child protection, court reports, Cultural Support Plans, quarterly reports, LAC documentation, CIMS reporting and Data collection as required maintain records using the relevant client information systems and keep paper files in line with program requirements. Actively participate in teamwork in a manner that ensures a co-ordinated approach to service delivery and participate in professional development and training. Lead and attend meetings to support the case management of families and advocate for children and families as required. Facilitate supervised contact between children and their families. Travel to meet with families and some overnight and interstate travel may be required. Other duties as directed by your Team Leader/ Program Manager.",Kinship Case Contracting Case Manager,,2026-02-16 04:43:37+00:00,2026-02-16 04:43:37+00:00,bdac,SYD
152,Team Leader Public Intoxication Response,"About the Position The Public Intoxication Response (PIR) service plays a crucial role in addressing the health and wellbeing needs of Aboriginal and/or Torres Strait Islander individuals who are intoxicated in the Greater Bendigo/Castlemaine areas, aligning with the recent decriminalisation of public intoxication by the Victorian Government. The PIR Team Leader will hold a supporting position in this service, ensuring that the program operates effectively and efficiently. The core function of the PIR team is to provide an outreach-based response to individuals in need. This response includes conducting thorough health assessments, offering safe transportation to an appropriate location, monitoring the health and overall well-being of the individual, and delivering follow-up care as needed. In essence, the PIR service operates as a critical lifeline for those who are intoxicated, ensuring their safety and well-being while also contributing to a more compassionate and health-focused approach in the context of public intoxication. Key Responsibilities The Public Intoxication Response (PIR) Team Leader will have the following responsibilities: Contribution to PIR Model Development and Evaluation: This entails actively participating in the development of the PIR model, evaluating its effectiveness, and making necessary adjustments to ensure it aligns with the evolving needs of Community. Recruitment and Management: The PIR Team Leader will support the Program Manager in recruitment and day-to-day management of the PIR team, ensuring that they are well-trained, motivated, and capable of carrying out their roles effectively. Liaison With Other Internal BDAC Programs: Work with other areas of BDAC to facilitate referral pathways while integrating with the broader Health Wellbeing Team. Staff Rostering, Including On-Call Scheduling: Organising and managing staff rosters, which include on-call schedules to ensure that there is adequate coverage and response readiness. Client Wellbeing Oversight: The PIR Team Leader will provide oversight, offering guidance and support to the team in handling complex cases, ensuring adherence to protocols, and maintaining high standards of care. Reporting and Evaluation: The Team Leader will be responsible for collecting data, preparing reports, and evaluating the programs performance. Client Advocacy: The PIR Team Leader advocates for the rights and well-being of clients, ensuring that they receive appropriate care and support while navigating the complexities of the program Community and Stakeholder Engagement: Working with the Program Manager to build meaningful stakeholder relationships that will benefit Community using the service.",Team Leader Public Intoxication Response,,2026-02-16 04:43:44+00:00,2026-02-16 04:43:44+00:00,bdac,SYD
25,Chronic Care Coordinator,"Position Objective The Chronic Care Coordinator will: Ensure that patients are accessing services consistent with their GP Care Plan, including provision of appropriate clinical care, arranging the services required and ensuring regular reviews are undertaken by the patients primary care providers. Ensure a patients access to an urgent and essential health or specialist services, including certain medical aids or the necessary transport to access the series, where this is not publicly available. Key Position Responsibilities Primary Responsibilities Review eligibility under the Care Coordinator Supplementary Services (CCSS). Aboriginal Patients must be enrolled for chronic disease management in a medical service and have a current care plan. Ensure that patients are accessing services consistent with their GP Management Plan including clinical care arranging follow-ups and regular reviews of the plan are undertaken Ensure that patients are able to access specialist appointments through providing appropriate care and purchase of medical aids. Ensure that priority is given to patients most in need of care coordination services to improve health outcomes. Work closely with Murray PHN and the Aboriginal Health Project Manager for guidance around clinical governance, risk management and reporting on use of supplementary services funding. Promote and educate the local Aboriginal community to explain the role of the Chronic Care Coordinator and how the service can be accessed Build and maintain networks with relevant service providers and agencies. Administration Compliance Model and abide by BDAC Values, Code of Conduct and Policy and Procedures; Participate actively in and facilitate supervision and professional development activities; Ensure that you participate in team meetings, staff meetings and other community activities as requested; Ensure that you adhere to legislative requirements; Ensure that you report any risks identified immediately to your line manager; Participate within the team to ensure performance against expectations including performance management and staff development, in accordance with BDACs policies and procedures; Ensure that all staff are provided with and operate in a safe environment in accordance with BDACS OHS policies and procedures; Participate in Continuous Quality Improvement (CQI) activities.",Chronic Care Coordinator,,2026-02-16 04:43:37+00:00,2026-02-16 04:43:37+00:00,bdac,SYD
107,"Client Support Officer, Initial Assessments","Role Purpose Deliver a broad range of general administrative support that focusses on training contract processing, call centre customer service information and advice, and adhering to and monitoring contact points with employers and apprentices to ensure processes meet the operating guidelines, record keeping requirements, and time-frame expectations. Key Responsibilities Receive inbound calls from clients and handle general advice queries Complete Initial Assessments through outbound calls Book in sign-up meetings for consultants and advisers Complete accurate data entry and maintain databases Provide support to the Sales and Operations teams Prove accurate advice to clients Other general administrative duties as required Key Performance Indicators/Measures Number of calls handled Accuracy targets Client feedback and NPS scores Number of administrative tasks completed","Client Support Officer, Initial Assessments",,2026-07-07 03:21:43+00:00,2026-07-07 03:21:43+00:00,cciwa,SYD
72,Manager Assets and Works,"This position holds Authorisations and Delegations Purchasing Authority Level: $60,000",Manager Assets and Works,,2025-07-10 01:37:41+00:00,2026-05-26 08:45:07+00:00,sdwk,SYD
226,Senior Data Entry Officer,The Senior Data Entry Officer position will work within a team of data specialists to ensure timely and accurate entry of client data into STARTTS systems. Individual must uphold strict confidentiality and is responsible for meeting strict reporting deadlines,1102-SDEO,"ESSENTIAL REQUIREMENTS: Demonstrated experience in leading and coordinating administrative or data operations within a complex service delivery environment. Demonstrated ability to develop, implement and review policies, procedures and systems to support data quality, compliance and operational efficiency. Demonstrated ability to analyse data, identify trends and provide advice to support decision-making and continuous improvement. Demonstrated experience in supervising, mentoring and developing staff, including setting priorities and monitoring performance. Demonstrated ability to manage competing priorities, resolve complex issues and exercise sound judgement and initiative. Well-developed oral, written and interpersonal communication skills and proficiency in the use of Microsoft Office. Ability to work independently and as part of a multidisciplinary team within a multicultural environment.",2026-01-14 03:24:03+00:00,2026-04-28 04:32:29+00:00,startts,SYD
11,Carnivals Coordinator,"Job Summary The Carnivals Co-ordinator will oversee the operation of Struddys carnivals, with a focus on our major contracts (SSA & QRSS). They will be responsible for ordering merchandise, event management, and managing carnival staff. Specifically, they will organise logistics, including set-up and pack-down of events and ensuring necessary equipment is ordered, manage staff hours/carnival roster, and ensure merchandise for carnivals is ordered in advance. They will ensure that Struddys merchandise tents adhere to Work Health and Safety standards, and that carnival staff are following all company policies and procedures. Responsibilities and Duties Required to work flexible hours during carnival season, including weekend work and overtime. Keep Struddys merchandise tents clean and tidy at all times. Responsible for carnival event management, including set-up and pack-down of events, ensuring necessary equipment is ordered, and managing carnival staff on-site. Manage staff working at events, ensuring they clock in-and-out correctly, are following the roster and taking breaks as instructed. Ensure merchandise is ordered for each event in advance. Organise staffing for calendared events in advance. Ensure that Struddys merchandise tents adhere to Work Health and Safety standards. Ensure carnivals staff adhere to all company policies and procedures. Report on the results of each carnival to upper management, including total sales, stock turnover, and staff efficiency.",Carnivals Coordinator,Valid driver’s licence Excellent organisational skills Proven leadership skills Able to work under pressure Strong work ethic Excellent communication skills,2025-08-05 06:46:46+00:00,2025-11-19 00:58:40+00:00,struddys,SYD
73,Career Coach - IEA - Goldfields-Esperance Region,"The Career Coach (CC) plays a crucial role in empowering individuals with disability, injury, or a health condition to achieve their employment goals under the new Inclusive Employment Australia (IEA) framework. This role involves providing information, support, and representation to participants to ensure their rights are upheld and they can participate fully and equally in the IEA program and the broader community. This role assists participants throughout their employment journey from initial contact and job preparation to securing and maintaining employment. The Disability Advocate focuses on addressing both individual and systemic barriers to inclusive employment, promoting self-advocacy, and ensuring participants’ needs are met in the workplace and beyond.",Career Coach - IEA - Goldfields-Esperance Region,,2025-09-23 04:29:00+00:00,2025-09-23 05:10:02+00:00,taga,SYD
14,Support Faculty - KI to 05,"Faith Basis of Appointment We see the appointment of staff to Trinity Christian School as a ministry calling. The ethos, aims and objects of a Christian School are based on: > acceptance of the Lordship of Christ; and > acceptance of the Bible as the revealed Word of God Within Trinity Christian School these are expounded in the Doctrinal Basis. The Doctrinal Basis does not exhaust the extent of the beliefs of the School and its members. The Bible itself, as the inspired and infallible Word of God, that speaks with final authority concerning truth, morality, and the proper conduct of mankind, is the sole and final source of all that the School and its members believe. You must support the School in these areas and set an example of personal conduct and behaviour consistent with the School’s beliefs and ethos as outlined in documents made available to prospective employees prior to interview. Any appointment is conditional upon staff maintaining and demonstrating a continuing firm personal belief and lifestyle consistent with the School’s Doctrinal Basis and the other documents provided to staff, this being an essential condition of the appointment. A Learning Centred Christian School At Trinity Christian School we endeavour to make the link between our faith, what we do and how we teach. We call our students and school community to grow “loving hearts, enquiring minds and generous spirits”. At Trinity, how we teach must help our students in becoming who they were created to be in Christ. How we teach should also bring a Kingdom perspective, set students’ minds on things above, deliver meaning and show purpose. The pedagogy in our classrooms at Trinity should engage enquiring minds, build questioning, allow for grappling, exploring and reasoning. The students we teach should be given opportunities to grow and serve, so they may see who they are becoming and their purpose. As we undertake to grow our learners in both faith and learning, we must build in them the capacity to do so. As stated in our Strategic Priorities for 2024 – 2027, we have several key areas of focus that we are working toward: Christian Faith and Growth The spiritual nurturing of all individuals in the Christian faith, within a caring community of students, staff and families united by vision, mission and values. A passionate focus on realising the transformative power of the Gospel of Jesus, developing Biblical knowledge, and understanding and fulfilling the purpose of a Christian life. Excellence in Education and Learning All students actively engaged, growing and thriving as learners in a learning centred school. Parent partnership and student agency enhanced and supported. A commitment to educational excellence with the creation and support of new ways of learning, varied student pathways and models of education, to meet the needs of each learner. Community and Belonging A movement by all students, staff and families from joining and attending the school to belonging and actively investing in the Trinity community. Connection and relationship developed and strengthened with those in the School’s history as well as future community members. Connecting with the World and Shaping Tomorrow Ongoing design and formation of our 2030 learning environment for the community now and in the future. A growth in our reach and impact on Christian Education nationally and globally, including shaping a reputation as a centre for staffing development and excellence. Benefits of Working at Trinity Christian School Trinity Christian School is an employer that promotes staff excellence and values the benefit that our professional team bring to the school. In addition to the highly competitive remuneration and conditions as set out in the MEA we offer the following additional benefits to our staff across the school including: > Attractive salary packaging arrangements. > School fee concessions. > Generous annual Staff Development Award program. > Access to an Employee Assistance Program. > Access to annual influenza vaccinations. Other Essential Requirements Employment Conditions Employment will be subject to the conditions of the current ACT Christian School General Staff Multi-Enterprise Agreement 2021 or its replacement. The salary and classification for this position will be dependent on the qualifications and experience of the successful applicant. A Committed, Practicing Christian Applicants must be able to demonstrate a personal faith and commitment to the Lord Jesus Christ and a lifestyle consistent with that faith, including an active commitment to a Christian fellowship. Right to Work In Australia Applicants must be Australian Citizens or hold a current and valid working visa. The School will not consider sponsorship nor support a visa application process. Please do not submit an application if you cannot meet this requirement. Working With Vulnerable People Check In keeping with the School’s policy and legislative requirements, any offer of employment is subject to you providing a satisfactory Working With Vulnerable People check prior to commencing employment and maintaining this for the duration of your employment. Acknowledgement The requirements of this job description are intended to describe the general nature and responsibility of the work in this role. These statements are not to be construed as an exhaustive list of all duties, tasks and skills required of the job. Employees will also be required to follow any other job-related instructions and school policies, and to perform other job-related duties requested by their Manager to support the School’s compliance with its legislative obligations. The Manager may, through consultation with the employee, vary the responsibilities of the position temporarily as required, but within the skills and responsibility levels appropriate to the position. Further Information All enquiries will be treated confidentially. Initial questions can be directed to the People & Culture Administrator, Katherine Boyd by phone on +61 2 6210 7500 or email employment@tcs.act.edu.au Applications are ongoing and are to be submitted electronically as a single PDF document as an attachment to the online application form. Trinity Christian School 34 McBryde Crescent Wanniassa ACT Australia 2903",222001,,2026-03-10 00:26:12+00:00,2026-05-08 04:05:26+00:00,tcsact,SYD
211,Finance Officer,"About the Position As a member of the Finance Team, the Finance Officer is primarily responsible for supporting BDACs operations in managing the day-to-day financial operations of BDAC and will undertake a wide range of finance related tasks to achieve this. The role will be supported by the Financial Accountant, and involves managing financial records, processing transactions, and assisting with financial reporting and reconciliations. The Finance Officer plays a vital role in ensuring the efficient operation of the Finance Team by maintaining accurate records and supporting financial processes. Key Responsibilities Processing accounts payable and receivable transactions, ensuring timely and accurate payments and collections. Assist with payroll processing and reporting, including verifying pay amounts, hours of work, deductions, and the payment and lodgement of superannuation. Reconciling bank statements and financial transactions, identifying and resolving discrepancies. Complying with and assisting in enforcing financial policies and procedures, including the delegation of approval for payments. This includes maintaining internal controls by monitoring financial processes and reporting any irregularities Assist in the preparation, maintenance, and processing of financial documents, including invoices, receipts, credit cards, purchase orders, and contracts. Handle correspondence related to financial matters, including responding to enquiries and communicating with vendors, clients, and internal teams. Support the finance team in preparing for audits, budgets and reporting as directed. Perform general administrative finance duties, including the management petty cash, essential cards, filing, and photocopying. Other additional duties as necessary to ensure the smooth operation of the finance team.",Finance Officer,,2026-02-16 04:43:47+00:00,2026-02-16 04:43:47+00:00,bdac,SYD
8,Aboriginal Men's Hub Practitioner - The Orange Door,"The Position This is an exciting new role based in the Aboriginal Response Team in the Loddon Orange Door. The successful applicant will work with Aboriginal men and younger males, as well as fathers of Aboriginal children, coming through The Orange Door (TOD) for support around family violence and child wellbeing. The role will work to support men to engage with services, including working collaboratively to transition men into programs run through BDAC, most commonly with the mens practitioners in the Family Safety and Healing Program, as well as Family Services, AOD and SEWB, amongst others. The successful applicant will develop strong relationships across the service system in the Dja Dja Wurrung region to support the best service connection for men coming through TOD. Key Responsibilities Providing culturally safe and responsive support to Aboriginal men, young males and fathers/carers of Aboriginal children by: Co-working and providing daily specialist practice support for the Hubs staff Managing a caseload of complex and/or sensitive cases Operating with autonomy and accountability in supporting Aboriginal men, young people and fathers/carers of Aboriginal children. Working directly with the Mens Practitioners in the BDAC Family Safety and Healing Program to promote effective transition from TOD to ongoing support for people who use violence (PUV), young males and fathers of Aboriginal Children needing family support. Mentoring and developing Hub Staff in working with Aboriginal men, young males and fathers/carers of Aboriginal children: Building capability of Hub practitioners to deliver culturally competent responses to Aboriginal children, women and men, informed by cultural expertise, client experience and in line with the relevant practice frameworks and legislation Providing practitioners with relevant information and access to systems to support safe and effective responses to Aboriginal children and families as part of an integrated practice approach Modelling integrated practice approaches and behaviours integral to ethical clinical practice working with Aboriginal children and families Sharing practice knowledge on Aboriginal approaches to holistic healing and whole of family practices Building the cultural safety of the Hub and supporting choice and self-determination of Aboriginal people. Liaising with organisations and services within the Hub network in order to improve direct service issues for Aboriginal people accessing services through the Hub. Keep accurate and complete records of your work activities in accordance with legislative requirements and the Victoria Governments, information security and privacy policies and requirements. Take reasonable care for your own health and safety and for that of others in the workplace by working in accordance with legislative requirements and occupational health and safety (OHS) policies and procedures. Other duties as directed by the Aboriginal Practice Leader and consistent with the overall goals and responsibilities of this position",Aboriginal Men's Hub Practitioner - The Orange Door,,2026-02-16 04:43:36+00:00,2026-02-16 04:43:36+00:00,bdac,SYD
