14,Operations Manager - Facilities & Logistics,"The Operations Manager - Facilities & Logistics is responsible for the efficient and safe management of all organisational facilities, infrastructure, and logistical operations. This role ensures that the physical environment and resources adequately support program delivery and organisational activities, while adhering to Work Health and Safety (WHS) regulations and other relevant Australian standards. Key Responsibilities: Oversee the maintenance, security, and operational efficiency of all organisational facilities, including offices, community centres, and program-specific sites. Develop and implement facility management strategies, including planned preventative maintenance schedules and emergency response plans. Manage procurement processes for operational supplies, equipment, and services, ensuring cost-effectiveness and quality. Oversee the logistics of transporting goods, materials, and potentially clients or staff, ensuring timely and safe delivery. Manage the organisation's fleet of vehicles (if applicable), including maintenance, registration, and usage policies. Ensure strict compliance with all Australian Work Health and Safety (WHS) legislation and standards across all facilities and logistical operations. Manage service contracts with external vendors for cleaning, security, maintenance, and other facility-related services. Develop and manage budgets for facilities, logistics, and fleet operations. Implement sustainable practices in facility management and resource consumption where possible. Lead and manage the Facilities Coordinator, Logistics Officer, and Fleet Coordinator roles.",OMFL,"Essential: Tertiary qualification in Facilities Management, Logistics, Business Administration, or a related field. Minimum of 5-7 years of experience in facilities management, logistics, or operations, with demonstrated experience in a supervisory or management role. Strong understanding of Australian Work Health and Safety (WHS) legislation and its practical application. Proven experience in contract management and vendor negotiation. Excellent organisational and problem-solving skills, with attention to detail. Experience in managing operational budgets. Valid Australian Driver's License. Desirable: Experience working within the not-for-profit sector. Certification in facilities management or project management. Knowledge of environmental sustainability practices in facility operations.",2025-06-20 02:10:08+00:00,2026-03-02 03:09:46+00:00,tomorrowspeople,SYD
85,Residential Manager,"The Residential Manager at Company Name plays a vital role in ensuring the smooth operation and management of residential facilities. This position demands a proactive leader who can maintain high standards of care, safety, and comfort for all residents. Key responsibilities include: Overseeing the daily operations of the residential facility to ensure compliance with company policies and regulatory requirements. Managing staff schedules, training, and performance evaluations to foster a productive team environment. Developing and implementing care plans tailored to meet the individual needs of residents. Maintaining effective communication with residents, families, and external stakeholders to address concerns and feedback. Coordinating activities and programmes that promote resident engagement and well-being. Ensuring the facility is compliant with health and safety regulations while maintaining a high standard of cleanliness and maintenance. Preparing budgets, monitoring expenditures, and ensuring financial sustainability of the residential service. Conducting regular assessments to evaluate the quality of services provided and implementing improvements as necessary. The ideal candidate will possess excellent leadership skills, strong organisational abilities, and a compassionate approach towards residents. The Residential Manager is essential in creating a supportive community atmosphere within the facility while upholding the values of Company Name.",RM1,"Required skills Strong leadership and management abilities Excellent communication and interpersonal skills Proficient in conflict resolution and problem-solving Sound knowledge of health and safety regulations Ability to create and maintain positive relationships with residents, families, and staff Financial acumen for budget management and resource allocation Organisational skills with attention to detail Competence in using relevant software systems for record keeping and reporting Required experiences A minimum of 3 years’ experience in a managerial role within a residential care setting Experience in developing care plans and conducting assessments Proven track record of improving service quality and resident satisfaction Experience working with regulatory bodies to ensure compliance with standards Diverse experience managing teams across various functions within a residential environment Background in training and developing staff members effectively Experience in handling budgets, financial reporting, and resource management",2025-08-15 00:27:43+00:00,2026-03-02 03:09:46+00:00,tomorrowspeople,SYD
124,Community Development Officer - Whyalla,"The Community Development Officer provides support the regional communities across Centacare CCSA’s service footprint through various engagement and development activities; including community events, community meetings and networks and supporting community, organisations and stakeholders to engage with Centacare initiatives and programs.",CDO-W,"An appropriate qualification in the human service sector Experience and connections in the human service sector across the region Experience in developing and facilitating groups, presentations and workshops Sound knowledge of Centacare CCSA regional communities, programs and stakeholders Sound knowledge of issues and challenges experienced by regional, rural and remote communities Demonstrated ability to work with and be sensitive/responsive to the differing needs of people from various cultural groups High level of ability to negotiate and communicate well, both verbally and in writing High level organisational and time management skills Demonstrated ability to work in a highly confidential manner Demonstrated high level of ability in the use of Microsoft Office and Information Technology",2026-05-25 01:00:53+00:00,2026-06-12 05:52:07+00:00,cccsa,SYD
168,"Senior, Industry Training Consultant (Metro)","Role Purpose The purpose of this role is to use your leadership skills and strong technical knowledge of Australian apprenticeships to provide support to your team and deliver an amazing service to our clients within the Australian Apprenticeship Support Network (AASN) guidelines. Key Responsibilities Provide day-to-day support to a small team Monitor and report on daily activities of sub-team to team leader Work closely with the Team Leader and other Seniors to ensure cohesive and high-quality customer service is delivered to clients Assist Apprenticeship Support Australia clients with claiming Federal government incentives Create, promote and maintain high team engagement levels Provide team feedback effectively Deliver high quality, knowledgeable and thorough training contract sign-ups to employers and apprentices/trainees. Administer and process contracts to lodge in an accurate and timely manner. Provide basic advice on incentives and eligibility. Undertake client retention activities with clients Undertake assessments of employers and apprentices to determine apprenticeship readiness Provide high quality customer service to clients throughout the training contract period. Deliver BD activities to identify and win new business opportunities Report on activity as required by team leader Represent ASA to a high standard at events Keep up-to-date on training contract regulations, policies and changes Promote, implement, administer, and support Australian Apprenticeships Be aware of and comply with all federal and state guidelines pertaining to Australian Apprenticeships Operate as a valuable Apprenticeship Support Australia team member being aware of the shared values of CCIWA Continue to complete day to day Industry Training Consultant tasks","Senior, Industry Training Consultant (Metro)",,2026-07-07 03:21:48+00:00,2026-07-07 03:21:48+00:00,cciwa,SYD
40,Trade Assistant,"To assist Electricians and Communications Technicians by completing hands on tasks as directed and ensuring all works performed are completed to a high standard, in a timely and safe manner.",Trade Assistant,A current and valid unrestricted Australian Drivers Licence Construction Induction White Card Strong communication abilities Excellent inter-personal skills with employees and customers - at all levels,2026-04-22 07:16:18+00:00,2026-04-28 06:12:17+00:00,cablewise,SYD
49,Volunteer Coordinator,"Functions of the Role This position is responsible for the overall management and oversight of volunteer services and coordination. Roles and Responsibilities Organisation Works within the role and responsibilities for the position and complies with all organisational policies, regulations and standards, and the Code of Conduct; Maintains professional and technical knowledge by participating in all training and development activities required; Represents the organisation as the first point of contact via a range of communication methods; Contributes effectively to team effort by accomplishing related results as needed; Maintains a high level of professionalism at all times. Duties and Tasks Manages and oversees all aspects of volunteer services and coordination; Supervises and supports the Volunteer Support Officer; Oversees the performance of volunteers; Liaises with Team Membersand managers to assess volunteer needs, identify gaps and provide support; Implements new and innovative volunteer programs based on organisational and community need; Engages in the broader volunteer sector for networking and building volunteer support; Responsible for developing a volunteer strategic plan that aligns with RangeCare's goals; Aligns our volunteer management with the National Standards for Volunteer Involvement; Introduces new tools and strategies to streamline processes; Provides annual reports on the volunteer program; Seeks grants and funding as needed; Facilitates group social activities as needed Other Ensures a strong customer service focus through responsive, effective customer engagement; Contributes effectively to organisational events and activities and represents the organisation in a professional manner at internal and external events; Performs other related duties as assigned by the Corporate Services Manager and ensure all deadlines are met.",PD-0016,"Appropriate qualifications and/ or experience in a comparable position; Ability to meet the requirements of Criminal History screening procedures; Ability to manage competing priorities and work under pressure; Strong time management and organisational skills; Strong leadership skills with the ability to supervise, develop and motivate Team Members and volunteers; Demonstrated high level of interpersonal skills including sound decision making, conflict resolution and problem solving; Demonstrated high level of communication skills both verbal and written and ability to utilise information technology; Current Driver's Licence.",2025-10-20 23:48:58+00:00,2025-11-04 02:19:36+00:00,rangecare,SYD
4,Professional Standards and Safeguarding Manager,"The Diocesan Professional Standards and Safeguarding Manager will manage the operations of the Professional Standards Office and be responsible to the Bishop for the ongoing management of old and new cases within the Diocese. The role will foster and enhance a culture that encourages cultural safety for children, young people, and adults-at-risk in compliance with the National Catholic Safeguarding Standards. The role will support the local Parish Safeguarding Representatives (PSRs) and have overall responsibility for the ongoing management of safeguarding complaints and professional standards cases. The Diocesan Professional Standards and Safeguarding Office will ensure compliance with the Safeguarding Policy across all the Diocesan entities and in all parishes. This will be achieved through the provision of induction and education resources and setting up and maintenance of recording systems for parishes and quality control of induction and training. Key Responsibilities Professional Standards • Support and advise the Bishop in the management of boundary violation cases. • Implement and continue to reflect on the outcomes of the recommendations of the Royal Commission into Institutional Responses to Child Sexual Abuse and consider the implications for the Catholic Diocese of Rockhampton. • Provide timely, contemporaneous, professional advice to the Bishop on all matters relating to professional standards and the Diocese’s Code of Conduct. • Advise on compliance with the National Response Protocol. • Conduct Professional Standards processes at the request of the Bishop. • Connect with the Director of the Professional Standards Office of Queensland on professional standards matters. • Receive requests and professional standards declarations of visiting clergy, religious and lay people, advise the Bishop, and record and issue approval letters. • Manage the Australian Catholic Ministry Register (ACMR) for clergy. • Advise the Bishop of expiry of Blue Card, Police Checks and ACMR statuses. • Liaise with statutory authorities on professional standards and safeguarding matters as required/mandated. • Receive complaints/concerns from within and without of the Diocese and act in accordance with procedures in an empathic and trauma-informed manner. • Establish and manage the Diocesan response to survivors of abuse and manage the support process for respondents, including pastoral support and the establishment and of Risk Management Plans and implementation of relevant supports. • Complete professional standards risk assessments as required. • Complete and manage Safety Plans as required. • Keep timely, accurate and confidential notes. • Provide information to other church entities and Australian Catholic Safeguarding Ltd (ACSL) as required. • Provide information to diocesan insurers as directed by the Director of Diocesan Services. • Respond to queries from within and outside the Church on professional standards and safeguarding relevant matters. • Serve as the Executive Officer, and advise and collaborate with the Bishop’s Professional Standards Committee and the Bishop about appropriate management of all abuse allegations, claims or concerns, including effective communication. • Ensure integration between the Risk Management Committee and the Safeguarding Committee by participating on the Risk Management Committee. • Support/advise and attend facilitation and apology sessions as required by the Bishop. • Manage participation in the National Redress Scheme in collaboration with legal advisors. • Provide accurate and timely evidence, reports and research to Diocesan solicitors. • Attend regular meetings with Director of Professional Standards Office Catholic Church Queensland. • Attend regular meetings with Catholic Education Student Protection lead and CatholicCare Central Queensland Safeguarding lead. • Establish and manage the Diocesan response to survivors of abuse and manage the support process for respondents, including pastoral support and the establishment and of Risk Management Plans and implementation of relevant supports. • Monitor and take calls made to the Professional Standards 1800 number during business hours, checking occasionally on weekends. • Be available to respond to and support the Bishop through a professional standards crisis outside of business hours, if required. Safeguarding • Advise the Bishop on all matters applying to safeguarding within the Diocese. • Ensure safeguarding policies and procedures are compliant with National Catholic Safeguarding Standards and write/update policies and procedures as necessary. • Ensure parishes are compliant with policies and procedures through internal audit. • Ensure every parish has a formally appointed and inducted PSR. • Support PSRs in their roles, including by coordinating group PSR meetings. • Ensure that safeguarding training is provided as per the NCSS and Diocese requirements. • Maintain a training database. • Review and update safeguarding training in light of NCSS, legislation and feedback. • Oversee the volunteer recruitment process and recording of this information. • Manage the safeguarding risks contained on the risk matrix and attend Diocesan and agency Risk Management Committee meetings on request. • Attend provincial safeguarding meetings and host annual provincial safeguarding meetings. • Provide tailored training to clergy, religious, and seminarians as required. Reporting & Supervision • Provide regular briefings and written monthly management reports to the Bishop. • Engage in external professional supervision for case management matters as approved by the line manager. • Engage in managerial supervision and appraisal. • Engage in spiritual supervision for personal well-being as approved by the line manager. • Respond to reporting requests from the Australian Catholic Bishops’ Conference (ACBC) and ACSL. Safeguarding & Professional Standards Office • Manage the operations of the Professional Standards Office. • Supervise the Safeguarding Administration Officer, if applicable, ensuring the timely and accurate processing of permission applications, Working with Children Checks, Australian Catholic Migrant & Refugee applications, and the provision of pastoral support.",JOB004,"• Tertiary qualifications in justice, social work, child protection or education. • Demonstrated knowledge of child protection legislation and human rights. • High level communication skills both written and verbal. • Ability to set up and interrogate databases. • Sensitivity to cultural differences. • Knowledge of trauma-informed care approaches. • Undertake travel throughout the Diocese as required to fulfil the requirements of the position. • Work flexibly including outside of office hours to meet the requirements of the role. • As an employee of the Catholic Diocese of Rockhampton, you must not at any time during or subsequent to your period of employment, disclose any information concerning the business affairs, or property of the Catholic Diocese of Rockhampton to any third party unless pre-approved by the Bishop or required by law. • Active participant in the Catholic Church community and/or lifestyle compatible with the values and teachings of the Church. • Thorough knowledge of and commitment to the Diocesan Vision Statement and Values. • Knowledge of and commitment to Catholic Social Teachings. • Ability to provide a clear criminal history record check and obtain a Queensland Working with Children (Blue Card) Check. • Ensure ongoing disclosure of any criminal charges or allegations (current or historic), as soon as possible after such charges come to the employee’s attention and in accordance with the Personnel Screening Policy as amended from time to time. Failure to comply with this ongoing obligation to disclose may lead to disciplinary action, including dismissal. • Current motor vehicle driver’s licence. Desirable • Understanding of Catholic Church hierarchy and structures. • Demonstrated ability to set up training systems. • Demonstrated ability to manage a system of policies and procedures. • Demonstrated ability to establish and maintain an internal audit system.",2024-11-26 22:51:35+00:00,2026-03-12 23:00:03+00:00,rokcatholic,SYD
227,Payroll Officer,"Assist the Payroll Manager in preparing and processing the fortnightly payroll in compliance with NSW Health requirements and industrial awards. Maintain accurate payroll records in Preceda/ELMO, including employee details, leave, deductions, and allowances. Supporting staff with payroll related queries. Prepare and distribute payroll-related reports to internal stakeholders. Provide basic finance and administrative support to the finance team as required, such as assisting with accounts payable, responding to finance queries, and supporting audits. Taking primary responsibility of the payroll function during times Payroll Manager is on leave.",1077-PO,"ESSENTIAL REQUIREMENTS: Demonstrated experience in payroll administration, including data entry and pay run processing preferably within the NSW Health or public sector. Knowledge of NSW Health awards, agreements, and leave provisions. Understanding of payroll-related legislation, including taxation, superannuation, and Fair Work requirements. Strong attention to detail with the ability to maintain high levels of accuracy. Good organisational skills and the ability to meet deadlines in a busy work environment. Excellent oral, written and interpersonal communication skills and proficiency in the use of Microsoft Office. Ability to work independently and as part of a multidisciplinary team within a multicultural environment. Desirable Requirements: Experience using Preceda, Deputy or ELMO payroll systems. Experience with MYOB Advanced/Acumatica accounting software. Previous experience in a health or not-for-profit organisation.",2026-01-27 03:03:22+00:00,2026-01-27 03:03:22+00:00,startts,SYD
45,Direct Services Counsellor/Project Officer,The Counsellor/Project Officer position is designed to provide individual and group clinical assessment and treatment to traumatised clients; collaborate with communities and deliver training to other service providers. This position is located in Direct Services Teams and will be based in STARTTS Sydney Metropolitan Offices. The position will involve regular travel to other areas of Sydney,1064,"ESSENTIAL REQUIREMENTS: 1. Relevant tertiary qualifications in counselling, social work, psychology, or a related field with eligibility for membership of the relevant professional association. 2. Demonstrated assessment and counselling experience in a cross-cultural context and experience in working with children, adolescents, and adults in a clinical setting. 3. Demonstrated capacity providing clinical group treatment and demonstrated training skills. 4. Demonstrated understanding of the issues affecting refugees in particular resettlement issues, and the effects of torture on individuals, young people, families, and communities. 5. Proven excellent oral, written, and interpersonal communication skills and proficiency in the use of Microsoft Office. 6. Ability to work independently and as part of a multidisciplinary team within a multicultural environment. 7. Knowledge of the cultures and health needs of refugee communities in Sydney Metropolitan areas and experience in community development, community liaison and advocacy. 8. Hold a current NSW Driver’s Licence. Desirable Criteria: 1. Knowledge of local communities in Sydney metropolitan areas and available services. 2. Arabic/Assyrian/Dari/Farsi speaking counsellor/proficient in community languages",2025-10-01 00:43:08+00:00,2025-10-01 00:43:08+00:00,startts,SYD
84,Social Worker,"The role of Social Worker is to provide effective trauma informed therapeutic case work, counselling and support services for clients in various programs across the regional footprint in accordance with program requirements.",SW,"A degree in Social Work or appropriate other Human Services field reflective of the services offered by Centacare Experience in trauma informed therapeutic case work, counselling and support services utilising a high level of skills Experience in developing and facilitating groups, presentations and workshops. (A Certificate IV in Training and Assessment is desirable but not essential) Sound knowledge of a range of practice theories and therapeutic interventions Sound knowledge of issues around family relationships and separation, family violence, suicide ideation, peer pressure, bullying, self-esteem, drug and/or alcohol abuse, mental health and mental illness Knowledge of issues related to service delivery in rural, regional and remote areas Demonstrated ability to work with and be sensitive to the differing needs of people from various culturally diverse groups High level of negotiation and communication skills, both verbally and in writing Exceptional organisational and time management skills Demonstrated ability to work in a highly confidential manner Proficient in the use of Microsoft Office and Information Technology",2026-05-25 01:00:52+00:00,2026-06-17 02:17:33+00:00,cccsa,SYD
